variant,soc4,title,karpathy_score,num_jobs_2024,occupation_count,karpathy_zscore,karpathy_percentile,comparison_key,comparison_level_left,raw_code_examples,raw_title_examples,source_row_count,metric_value,metric_name,comparison_level_right,source_file,sheet_name,metric_zscore,metric_percentile,comparison_title
repo_gabriel,11-10,Top executives,7.4,4022200.0,1,1.233819532719265,0.8522727272727273,11-10,soc4,11-1011.00 | 11-1011.03 | 11-1021.00,Chief Executives | Chief Sustainability Officers | General and Operations Managers,3,0.2503340999999999,webb_soc4_ai_score,soc4,webb_exposure_by_soc4.xlsx,exposure_by_soc4,-0.8181010378641315,0.24074074074074073,Top executives
repo_gabriel,11-20,Sales managers,7.232459404600812,1182400.0,3,1.159081360261757,0.8181818181818182,11-20,soc4,11-2011.00 | 11-2021.00 | 11-2022.00 | 11-2031.00,Advertising and Promotions Managers | Marketing Managers | Sales Managers | Public Relations and Fundraising Managers,4,0.5579993225000001,webb_soc4_ai_score,soc4,webb_exposure_by_soc4.xlsx,exposure_by_soc4,0.775150607412759,0.8333333333333334,Sales managers
repo_gabriel,11-30,Financial managers,7.373492142266336,3022500.0,6,1.2219946443209797,0.8409090909090909,11-30,soc4,11-3011.00 | 11-3021.00 | 11-3031.01 | 11-3031.02 | 11-3051.00,"Administrative Services Managers | Computer and Information Systems Managers | Treasurers and Controllers | Financial Managers, Branch or Department | Industrial Production Managers",14,0.5393125057142857,webb_soc4_ai_score,soc4,webb_exposure_by_soc4.xlsx,exposure_by_soc4,0.6783804838775024,0.7962962962962963,Financial managers
repo_gabriel,11-31,Human resources managers,7.460995850622407,289200.0,3,1.2610291674477798,0.8636363636363636,11-31,soc4,11-3111.00 | 11-3121.00 | 11-3131.00,Compensation and Benefits Managers | Human Resources Managers | Training and Development Managers,3,0.4886859166666666,webb_soc4_ai_score,soc4,webb_exposure_by_soc4.xlsx,exposure_by_soc4,0.41620949282609726,0.6944444444444444,Human resources managers
repo_gabriel,11-90,"Farmers, ranchers, and other agricultural managers",4.878529287821324,2847600.0,10,0.10901683947135504,0.5795454545454546,11-90,soc4,11-9013.01 | 11-9013.02 | 11-9013.03 | 11-9021.00 | 11-9031.00,"Nursery and Greenhouse Managers | Farm and Ranch Managers | Aquacultural Managers | Construction Managers | Education Administrators, Preschool and Childcare Center/Program",15,0.5306007620000001,webb_soc4_ai_score,soc4,webb_exposure_by_soc4.xlsx,exposure_by_soc4,0.6332665126160408,0.7685185185185185,"Farmers, ranchers, and other agricultural managers"
repo_gabriel,11-91,Medical and health services managers,6.456997025419145,1479200.0,6,0.8131554018902993,0.7159090909090909,11-91,soc4,11-9111.00 | 11-9121.00 | 11-9121.01 | 11-9121.02 | 11-9131.00,Medical and Health Services Managers | Natural Sciences Managers | Clinical Research Coordinators | Water Resource Specialists | Postmasters and Mail Superintendents,17,0.4326621276470588,webb_soc4_ai_score,soc4,webb_exposure_by_soc4.xlsx,exposure_by_soc4,0.12608897382549594,0.5925925925925926,Medical and health services managers
repo_gabriel,13-10,Project management specialists,7.617545506860102,3301700.0,7,1.3308643926251709,0.875,13-10,soc4,13-1011.00 | 13-1021.00 | 13-1022.00 | 13-1023.00 | 13-1031.01,"Agents and Business Managers of Artists, Performers, and Athletes | Buyers and Purchasing Agents, Farm Products | Wholesale and Retail Buyers, Except Farm Products | Purchasing Agents, Except Wholesale, Retail, and Farm Products | Claims Examiners, Property and Casualty Insurance",20,0.48962319425,webb_soc4_ai_score,soc4,webb_exposure_by_soc4.xlsx,exposure_by_soc4,0.4210632070015013,0.7037037037037037,Project management specialists
repo_gabriel,13-11,Management analysts,7.907120678226285,2866300.0,6,1.460040960521521,0.9204545454545454,13-11,soc4,13-1111.00 | 13-1121.00 | 13-1131.00 | 13-1141.00 | 13-1151.00,"Management Analysts | Meeting, Convention, and Event Planners | Fundraisers | Compensation, Benefits, and Job Analysis Specialists | Training and Development Specialists",12,0.4818873878333333,webb_soc4_ai_score,soc4,webb_exposure_by_soc4.xlsx,exposure_by_soc4,0.3810031501619677,0.6759259259259259,Management analysts
repo_gabriel,13-20,Accountants and auditors,7.860192421356801,3045400.0,10,1.439106737704149,0.9090909090909091,13-20,soc4,13-2011.01 | 13-2011.02 | 13-2021.01 | 13-2021.02 | 13-2031.00,"Accountants | Auditors | Assessors | Appraisers, Real Estate | Budget Analysts",18,0.5555130127777779,webb_soc4_ai_score,soc4,webb_exposure_by_soc4.xlsx,exposure_by_soc4,0.7622751935996218,0.8240740740740741,Accountants and auditors
repo_gabriel,15-20,Data scientists,8.919263256687001,426200.0,4,1.9115475723987658,1.0,15-20,soc4,15-2011.00 | 15-2021.00 | 15-2031.00 | 15-2041.00 | 15-2041.01,Actuaries | Mathematicians | Operations Research Analysts | Statisticians | Biostatisticians,6,0.6246539533333334,webb_soc4_ai_score,soc4,webb_exposure_by_soc4.xlsx,exposure_by_soc4,1.1203231926585029,0.8703703703703703,Data scientists
repo_gabriel,17-10,Architects,6.617636109818521,214900.0,4,0.8848148797896769,0.7613636363636364,17-10,soc4,17-1011.00 | 17-1012.00 | 17-1021.00 | 17-1022.00 | 17-1022.01,"Architects, Except Landscape and Naval | Landscape Architects | Cartographers and Photogrammetrists | Surveyors | Geodetic Surveyors",5,0.64209918,webb_soc4_ai_score,soc4,webb_exposure_by_soc4.xlsx,exposure_by_soc4,1.2106637123410446,0.8796296296296297,Architects
repo_gabriel,17-20,Civil engineers,6.603527693517583,890100.0,8,0.878521257350951,0.75,17-20,soc4,17-2011.00 | 17-2021.00 | 17-2031.00 | 17-2041.00 | 17-2051.00,Aerospace Engineers | Agricultural Engineers | Biomedical Engineers | Chemical Engineers | Civil Engineers,12,0.7055285883333333,webb_soc4_ai_score,soc4,webb_exposure_by_soc4.xlsx,exposure_by_soc4,1.5391344064443504,0.9166666666666666,Civil engineers
repo_gabriel,17-21,Industrial engineers,6.928577208361429,741500.0,8,1.0235225726426025,0.7954545454545454,17-21,soc4,17-2111.01 | 17-2111.02 | 17-2111.03 | 17-2112.00 | 17-2112.01,Industrial Safety and Health Engineers | Fire-Prevention and Protection Engineers | Product Safety Engineers | Industrial Engineers | Human Factors Engineers and Ergonomists,25,0.6784601776,webb_soc4_ai_score,soc4,webb_exposure_by_soc4.xlsx,exposure_by_soc4,1.3989600000376792,0.9074074074074074,Industrial engineers
repo_gabriel,17-30,Drafters,6.156319444444445,576000.0,10,0.6790261608699325,0.6590909090909091,17-30,soc4,17-3011.01 | 17-3011.02 | 17-3012.01 | 17-3012.02 | 17-3013.00,Architectural Drafters | Civil Drafters | Electronic Drafters | Electrical Drafters | Mechanical Drafters,28,0.6106521731785713,webb_soc4_ai_score,soc4,webb_exposure_by_soc4.xlsx,exposure_by_soc4,1.0478146423351724,0.8611111111111112,Drafters
repo_gabriel,19-10,Medical scientists,6.73610444177671,333200.0,7,0.9376624096886149,0.7840909090909091,19-10,soc4,19-1011.00 | 19-1012.00 | 19-1013.00 | 19-1020.01 | 19-1021.00,Animal Scientists | Food Scientists and Technologists | Soil and Plant Scientists | Biologists | Biochemists and Biophysicists,16,0.552532450625,webb_soc4_ai_score,soc4,webb_exposure_by_soc4.xlsx,exposure_by_soc4,0.7468402818628448,0.8148148148148148,Medical scientists
repo_gabriel,19-20,Chemists and materials scientists,6.424466403162056,253000.0,6,0.798643818887938,0.7045454545454546,19-20,soc4,19-2011.00 | 19-2012.00 | 19-2021.00 | 19-2031.00 | 19-2032.00,Astronomers | Physicists | Atmospheric and Space Scientists | Chemists | Materials Scientists,12,0.7540037408333333,webb_soc4_ai_score,soc4,webb_exposure_by_soc4.xlsx,exposure_by_soc4,1.7901641323525919,0.9444444444444444,Chemists and materials scientists
repo_gabriel,19-30,Psychologists,6.568227424749164,299000.0,9,0.8627741629304949,0.7272727272727273,19-30,soc4,19-3011.00 | 19-3011.01 | 19-3022.00 | 19-3031.01 | 19-3031.02,Economists | Environmental Economists | Survey Researchers | School Psychologists | Clinical Psychologists,16,0.6104868725,webb_soc4_ai_score,soc4,webb_exposure_by_soc4.xlsx,exposure_by_soc4,1.0469586288541584,0.8518518518518519,Psychologists
repo_gabriel,19-40,Biological technicians,4.070688321732406,258600.0,7,-0.2513528804639121,0.5113636363636364,19-40,soc4,19-4011.01 | 19-4011.02 | 19-4021.00 | 19-4031.00 | 19-4041.01,Agricultural Technicians | Food Science Technicians | Biological Technicians | Chemical Technicians | Geophysical Data Technicians,16,0.652976629375,webb_soc4_ai_score,soc4,webb_exposure_by_soc4.xlsx,exposure_by_soc4,1.2669928416859606,0.8888888888888888,Biological technicians
repo_gabriel,21-10,Social workers,4.372995395363607,2519200.0,9,-0.11649673917862954,0.5340909090909091,21-10,soc4,21-1011.00 | 21-1012.00 | 21-1013.00 | 21-1014.00 | 21-1015.00,"Substance Abuse and Behavioral Disorder Counselors | Educational, Guidance, School, and Vocational Counselors | Marriage and Family Therapists | Mental Health Counselors | Rehabilitation Counselors",12,0.3067660298333333,webb_soc4_ai_score,soc4,webb_exposure_by_soc4.xlsx,exposure_by_soc4,-0.525866951988181,0.3148148148148148,Social workers
repo_gabriel,23-10,Lawyers,8.117786001959288,918700.0,3,1.5540166400185407,0.9431818181818182,23-10,soc4,23-1011.00 | 23-1012.00 | 23-1021.00 | 23-1022.00 | 23-1023.00,"Lawyers | Judicial Law Clerks | Administrative Law Judges, Adjudicators, and Hearing Officers | Arbitrators, Mediators, and Conciliators | Judges, Magistrate Judges, and Magistrates",5,0.5119342617999999,webb_soc4_ai_score,soc4,webb_exposure_by_soc4.xlsx,exposure_by_soc4,0.5366015990013353,0.7592592592592593,Lawyers
repo_gabriel,23-20,Paralegals and legal assistants,7.8,376200.0,1,1.4122555046804102,0.8920454545454546,23-20,soc4,23-2011.00 | 23-2091.00 | 23-2093.00,"Paralegals and Legal Assistants | Court Reporters | Title Examiners, Abstractors, and Searchers",3,0.2309919056666666,webb_soc4_ai_score,soc4,webb_exposure_by_soc4.xlsx,exposure_by_soc4,-0.9182650495598265,0.2037037037037037,Paralegals and legal assistants
repo_gabriel,25-10,Postsecondary teachers,6.6,1415600.0,1,0.8769475887969737,0.7386363636363636,25-10,soc4,25-1011.00 | 25-1021.00 | 25-1022.00 | 25-1031.00 | 25-1032.00,"Business Teachers, Postsecondary | Computer Science Teachers, Postsecondary | Mathematical Science Teachers, Postsecondary | Architecture Teachers, Postsecondary | Engineering Teachers, Postsecondary",23,0.0158849577826086,webb_soc4_ai_score,soc4,webb_exposure_by_soc4.xlsx,exposure_by_soc4,-2.0322014764394214,0.009259259259259259,Postsecondary teachers
repo_gabriel,25-11,Career and technical education teachers,3.8,239600.0,1,-0.37210421493104484,0.48295454545454547,25-11,soc4,25-1111.00 | 25-1112.00 | 25-1113.00 | 25-1121.00 | 25-1122.00,"Criminal Justice and Law Enforcement Teachers, Postsecondary | Law Teachers, Postsecondary | Social Work Teachers, Postsecondary | Art, Drama, and Music Teachers, Postsecondary | Communications Teachers, Postsecondary",13,0.0513966726923076,webb_soc4_ai_score,soc4,webb_exposure_by_soc4.xlsx,exposure_by_soc4,-1.84830321927946,0.018518518518518517,Career and technical education teachers
repo_gabriel,25-20,Kindergarten and elementary school teachers,4.2645187788071,4382600.0,5,-0.16488706545442147,0.5227272727272727,25-20,soc4,25-2011.00 | 25-2012.00 | 25-2021.00 | 25-2022.00 | 25-2023.00,"Preschool Teachers, Except Special Education | Kindergarten Teachers, Except Special Education | Elementary School Teachers, Except Special Education | Middle School Teachers, Except Special and Career/Technical Education | Career/Technical Education Teachers, Middle School",11,0.3564728427272727,webb_soc4_ai_score,soc4,webb_exposure_by_soc4.xlsx,exposure_by_soc4,-0.268459043543997,0.4074074074074074,Kindergarten and elementary school teachers
repo_gabriel,25-30,Tutors,6.268096723868955,256400.0,2,0.7288888796131451,0.6704545454545454,25-30,soc4,25-3011.00 | 25-3021.00 | 25-3099.02,Adult Basic and Secondary Education and Literacy Teachers and Instructors | Self-Enrichment Education Teachers | Tutors,3,0.41305087,webb_soc4_ai_score,soc4,webb_exposure_by_soc4.xlsx,exposure_by_soc4,0.024531611383839427,0.5462962962962963,Tutors
repo_gabriel,25-40,Library technicians and assistants,6.352692530399537,345400.0,3,0.7666262170184487,0.6818181818181818,25-40,soc4,25-4011.00 | 25-4012.00 | 25-4013.00 | 25-4021.00 | 25-4031.00,Archivists | Curators | Museum Technicians and Conservators | Librarians | Library Technicians,5,0.2192249931999999,webb_soc4_ai_score,soc4,webb_exposure_by_soc4.xlsx,exposure_by_soc4,-0.9792002846020186,0.18518518518518517,Library technicians and assistants
repo_gabriel,25-90,Teacher assistants,3.7041923402198864,1655400.0,2,-0.41484304716651305,0.45454545454545453,25-90,soc4,25-9011.00 | 25-9021.00 | 25-9031.00 | 25-9031.01 | 25-9041.00,Audio-Visual and Multimedia Collections Specialists | Farm and Home Management Advisors | Instructional Coordinators | Instructional Designers and Technologists | Teacher Assistants,5,0.33227755,webb_soc4_ai_score,soc4,webb_exposure_by_soc4.xlsx,exposure_by_soc4,-0.39375494027370694,0.3611111111111111,Teacher assistants
repo_gabriel,27-10,Graphic designers,7.262498284145504,728500.0,9,1.1724814019322094,0.8295454545454546,27-10,soc4,27-1011.00 | 27-1012.00 | 27-1013.00 | 27-1014.00 | 27-1021.00,"Art Directors | Craft Artists | Fine Artists, Including Painters, Sculptors, and Illustrators | Multimedia Artists and Animators | Commercial and Industrial Designers",11,0.4637775063636363,webb_soc4_ai_score,soc4,webb_exposure_by_soc4.xlsx,exposure_by_soc4,0.2872206998320016,0.6481481481481481,Graphic designers
repo_gabriel,27-20,Coaches and scouts,4.401369863013699,803000.0,8,-0.10383917489356917,0.5454545454545454,27-20,soc4,27-2011.00 | 27-2012.01 | 27-2012.02 | 27-2012.03 | 27-2012.04,"Actors | Producers | Directors- Stage, Motion Pictures, Television, and Radio | Program Directors | Talent Directors",15,0.3002113129333333,webb_soc4_ai_score,soc4,webb_exposure_by_soc4.xlsx,exposure_by_soc4,-0.5598107087780768,0.2962962962962963,Coaches and scouts
repo_gabriel,27-30,Public relations specialists,7.963690550105551,805300.0,8,1.4852762107027568,0.9318181818181818,27-30,soc4,27-3011.00 | 27-3012.00 | 27-3021.00 | 27-3022.00 | 27-3031.00,Radio and Television Announcers | Public Address System and Other Announcers | Broadcast News Analysts | Reporters and Correspondents | Public Relations Specialists,10,0.1841147896,webb_soc4_ai_score,soc4,webb_exposure_by_soc4.xlsx,exposure_by_soc4,-1.1610193059303275,0.12962962962962962,Public relations specialists
repo_gabriel,27-40,Photographers,5.8230646871686105,377200.0,3,0.5303645695569598,0.6363636363636364,27-40,soc4,27-4011.00 | 27-4012.00 | 27-4013.00 | 27-4014.00 | 27-4021.00,Audio and Video Equipment Technicians | Broadcast Technicians | Radio Operators | Sound Engineering Technicians | Photographers,7,0.5419632314285714,webb_soc4_ai_score,soc4,webb_exposure_by_soc4.xlsx,exposure_by_soc4,0.6921073298016089,0.8055555555555556,Photographers
repo_gabriel,29-10,Pharmacists,4.521191509323326,852700.0,7,-0.05038794509046188,0.5568181818181818,29-10,soc4,29-1011.00 | 29-1021.00 | 29-1022.00 | 29-1023.00 | 29-1024.00,"Chiropractors | Dentists, General | Oral and Maxillofacial Surgeons | Orthodontists | Prosthodontists",30,0.3863797074666666,webb_soc4_ai_score,soc4,webb_exposure_by_soc4.xlsx,exposure_by_soc4,-0.11358563580577681,0.4722222222222222,Pharmacists
repo_gabriel,29-11,Registered nurses,2.83058238969569,4689300.0,11,-0.8045516487582961,0.3522727272727273,29-11,soc4,29-1122.00 | 29-1122.01 | 29-1123.00 | 29-1124.00 | 29-1125.00,"Occupational Therapists | Low Vision Therapists, Orientation and Mobility Specialists, and Vision Rehabilitation Therapists | Physical Therapists | Radiation Therapists | Recreational Therapists",23,0.4871506369565218,webb_soc4_ai_score,soc4,webb_exposure_by_soc4.xlsx,exposure_by_soc4,0.4082590104664978,0.6851851851851852,Registered nurses
repo_gabriel,29-20,Licensed practical and licensed vocational nurses,3.569798183296222,2829300.0,14,-0.4747949272079451,0.4318181818181818,29-20,soc4,29-2011.00 | 29-2011.01 | 29-2011.02 | 29-2011.03 | 29-2012.00,Medical and Clinical Laboratory Technologists | Cytogenetic Technologists | Cytotechnologists | Histotechnologists and Histologic Technicians | Medical and Clinical Laboratory Technicians,28,0.45789311375,webb_soc4_ai_score,soc4,webb_exposure_by_soc4.xlsx,exposure_by_soc4,0.25674823324331797,0.6296296296296297,Licensed practical and licensed vocational nurses
repo_gabriel,29-90,Surgical assistants and technologists,3.268297101449275,220800.0,4,-0.6092915236746871,0.375,29-90,soc4,29-9011.00 | 29-9012.00 | 29-9091.00 | 29-9092.00 | 29-9099.01,Occupational Health and Safety Specialists | Occupational Health and Safety Technicians | Athletic Trainers | Genetic Counselors | Midwives,5,0.36317001,webb_soc4_ai_score,soc4,webb_exposure_by_soc4.xlsx,exposure_by_soc4,-0.23377760412337065,0.42592592592592593,Surgical assistants and technologists
repo_gabriel,31-20,Physical therapist assistants and aides,2.2514420803782507,211500.0,2,-1.0629003087456355,0.18181818181818182,31-20,soc4,31-2011.00 | 31-2012.00 | 31-2021.00 | 31-2022.00,Occupational Therapy Assistants | Occupational Therapy Aides | Physical Therapist Assistants | Physical Therapist Aides,4,0.2910931025,webb_soc4_ai_score,soc4,webb_exposure_by_soc4.xlsx,exposure_by_soc4,-0.6070295775759281,0.28703703703703703,Physical therapist assistants and aides
repo_gabriel,31-90,Medical assistants,3.3259459784635745,1662300.0,6,-0.5835749401683995,0.3977272727272727,31-90,soc4,31-9011.00 | 31-9091.00 | 31-9092.00 | 31-9093.00 | 31-9094.00,Massage Therapists | Dental Assistants | Medical Assistants | Medical Equipment Preparers | Medical Transcriptionists,10,0.2259018057,webb_soc4_ai_score,soc4,webb_exposure_by_soc4.xlsx,exposure_by_soc4,-0.944624252854295,0.19444444444444445,Medical assistants
repo_gabriel,33-20,Firefighters,1.592248275862069,362500.0,2,-1.356960026794661,0.011363636363636364,33-20,soc4,33-2011.01 | 33-2011.02 | 33-2021.01 | 33-2021.02 | 33-2022.00,Municipal Firefighters | Forest Firefighters | Fire Inspectors | Fire Investigators | Forest Fire Inspectors and Prevention Specialists,5,0.4117360734,webb_soc4_ai_score,soc4,webb_exposure_by_soc4.xlsx,exposure_by_soc4,0.01772290603478275,0.5370370370370371,Firefighters
repo_gabriel,33-30,Police and detectives,2.3363171977621016,1233300.0,2,-1.0250383735813762,0.19318181818181818,33-30,soc4,33-3011.00 | 33-3012.00 | 33-3021.01 | 33-3021.02 | 33-3021.03,Bailiffs | Correctional Officers and Jailers | Police Detectives | Police Identification and Records Officers | Criminal Investigators and Special Agents,12,0.4220133369166667,webb_soc4_ai_score,soc4,webb_exposure_by_soc4.xlsx,exposure_by_soc4,0.07094395869007061,0.5648148148148148,Police and detectives
repo_gabriel,33-90,Security guards and gambling surveillance officers,3.4927659574468084,1316000.0,2,-0.5091582274373715,0.4090909090909091,33-90,soc4,33-9011.00 | 33-9021.00 | 33-9031.00 | 33-9032.00 | 33-9091.00,Animal Control Workers | Private Detectives and Investigators | Gaming Surveillance Officers and Gaming Investigators | Security Guards | Crossing Guards,8,0.37730307875,webb_soc4_ai_score,soc4,webb_exposure_by_soc4.xlsx,exposure_by_soc4,-0.1605891726985321,0.4444444444444444,Security guards and gambling surveillance officers
repo_gabriel,35-10,Chefs and head cooks,2.6,197300.0,1,-0.9074121308144812,0.3068181818181818,35-10,soc4,35-1011.00 | 35-1012.00,Chefs and Head Cooks | First-Line Supervisors of Food Preparation and Serving Workers,2,0.39607833,webb_soc4_ai_score,soc4,webb_exposure_by_soc4.xlsx,exposure_by_soc4,-0.06336108919439339,0.49074074074074076,Chefs and head cooks
repo_gabriel,35-20,Cooks,2.175654026646529,3707800.0,2,-1.0967085963222936,0.125,35-20,soc4,35-2011.00 | 35-2012.00 | 35-2013.00 | 35-2014.00 | 35-2015.00,"Cooks, Fast Food | Cooks, Institution and Cafeteria | Cooks, Private Household | Cooks, Restaurant | Cooks, Short Order",6,0.1220167791666666,webb_soc4_ai_score,soc4,webb_exposure_by_soc4.xlsx,exposure_by_soc4,-1.4825953244591359,0.05555555555555555,Cooks
repo_gabriel,35-30,Food and beverage serving and related workers,2.344065541456203,8117000.0,3,-1.021581915486011,0.20454545454545456,35-30,soc4,35-3011.00 | 35-3021.00 | 35-3022.00 | 35-3022.01 | 35-3031.00,"Bartenders | Combined Food Preparation and Serving Workers, Including Fast Food | Counter Attendants, Cafeteria, Food Concession, and Coffee Shop | Baristas | Waiters and Waitresses",6,0.1209645223333333,webb_soc4_ai_score,soc4,webb_exposure_by_soc4.xlsx,exposure_by_soc4,-1.4880444614052595,0.046296296296296294,Food and beverage serving and related workers
repo_gabriel,37-20,Janitors and building cleaners,2.2,2550100.0,2,-1.0858481027756268,0.14772727272727273,37-20,soc4,37-2011.00 | 37-2012.00 | 37-2021.00,"Janitors and Cleaners, Except Maids and Housekeeping Cleaners | Maids and Housekeeping Cleaners | Pest Control Workers",3,0.4814530363333333,webb_soc4_ai_score,soc4,webb_exposure_by_soc4.xlsx,exposure_by_soc4,0.37875385062664735,0.6666666666666666,Janitors and building cleaners
repo_gabriel,37-30,Grounds maintenance workers,1.6,1296400.0,1,-1.3535020607173451,0.022727272727272728,37-30,soc4,37-3011.00 | 37-3012.00 | 37-3013.00,"Landscaping and Groundskeeping Workers | Pesticide Handlers, Sprayers, and Applicators, Vegetation | Tree Trimmers and Pruners",3,0.3782022833333333,webb_soc4_ai_score,soc4,webb_exposure_by_soc4.xlsx,exposure_by_soc4,-0.15593262045582212,0.4537037037037037,Grounds maintenance workers
repo_gabriel,39-20,Animal care and service workers,2.1,439400.0,1,-1.1304570957659132,0.10227272727272728,39-20,soc4,39-2011.00 | 39-2021.00,Animal Trainers | Nonfarm Animal Caretakers,2,0.273988756,webb_soc4_ai_score,soc4,webb_exposure_by_soc4.xlsx,exposure_by_soc4,-0.6956048412377512,0.26851851851851855,Animal care and service workers
repo_gabriel,39-50,"Barbers, hairstylists, and cosmetologists",1.6203191822259309,958700.0,3,-1.3444378781424962,0.03409090909090909,39-50,soc4,39-5011.00 | 39-5012.00 | 39-5091.00 | 39-5092.00 | 39-5093.00,"Barbers | Hairdressers, Hairstylists, and Cosmetologists | Makeup Artists, Theatrical and Performance | Manicurists and Pedicurists | Shampooers",6,0.2382966848333333,webb_soc4_ai_score,soc4,webb_exposure_by_soc4.xlsx,exposure_by_soc4,-0.8804370775482155,0.21296296296296297,"Barbers, hairstylists, and cosmetologists"
repo_gabriel,39-60,Concierges,5.8,45600.0,1,0.5200756448746827,0.6193181818181818,39-60,soc4,39-6011.00 | 39-6012.00,Baggage Porters and Bellhops | Concierges,2,0.1389198335,webb_soc4_ai_score,soc4,webb_exposure_by_soc4.xlsx,exposure_by_soc4,-1.3950624570522967,0.07407407407407407,Concierges
repo_gabriel,39-70,Tour and travel guides,3.8,55800.0,1,-0.37210421493104484,0.48295454545454547,39-70,soc4,39-7011.00 | 39-7012.00,Tour Guides and Escorts | Travel Guides,2,0.17121922,webb_soc4_ai_score,soc4,webb_exposure_by_soc4.xlsx,exposure_by_soc4,-1.2277993186826062,0.09259259259259259,Tour and travel guides
repo_gabriel,39-90,Childcare workers,2.047827631111637,1689400.0,3,-1.1537306641461893,0.09090909090909091,39-90,soc4,39-9011.00 | 39-9011.01 | 39-9021.00 | 39-9031.00 | 39-9032.00,Childcare Workers | Nannies | Personal Care Aides | Fitness Trainers and Aerobics Instructors | Recreation Workers,6,0.18394666,webb_soc4_ai_score,soc4,webb_exposure_by_soc4.xlsx,exposure_by_soc4,-1.1618899690479951,0.12037037037037036,Childcare workers
repo_gabriel,41-20,Retail sales workers,5.6000977464023896,7366000.0,2,0.43090126257990025,0.6022727272727273,41-20,soc4,41-2011.00 | 41-2012.00 | 41-2021.00 | 41-2022.00 | 41-2031.00,Cashiers | Gaming Change Persons and Booth Cashiers | Counter and Rental Clerks | Parts Salespersons | Retail Salespersons,5,0.1881223678,webb_soc4_ai_score,soc4,webb_exposure_by_soc4.xlsx,exposure_by_soc4,-1.1402659672564195,0.1388888888888889,Retail sales workers
repo_gabriel,41-30,Insurance sales agents,7.0202123413427,1252700.0,4,1.064400082690857,0.8068181818181818,41-30,soc4,41-3011.00 | 41-3021.00 | 41-3031.01 | 41-3031.02 | 41-3031.03,"Advertising Sales Agents | Insurance Sales Agents | Sales Agents, Securities and Commodities | Sales Agents, Financial Services | Securities and Commodities Traders",7,0.3342739942857143,webb_soc4_ai_score,soc4,webb_exposure_by_soc4.xlsx,exposure_by_soc4,-0.38341630623157696,0.37037037037037035,Insurance sales agents
repo_gabriel,41-40,Wholesale and manufacturing sales representatives,5.8,1613600.0,1,0.5200756448746827,0.6193181818181818,41-40,soc4,41-4011.00 | 41-4011.07 | 41-4012.00,"Sales Representatives, Wholesale and Manufacturing, Technical and Scientific Products | Solar Sales Representatives and Assessors | Sales Representatives, Wholesale and Manufacturing, Except Technical and Scientific Products",3,0.211914963,webb_soc4_ai_score,soc4,webb_exposure_by_soc4.xlsx,exposure_by_soc4,-1.0170554492141761,0.16666666666666666,Wholesale and manufacturing sales representatives
repo_gabriel,41-90,Real estate brokers and sales agents,6.38019137149572,595700.0,3,0.778893173115455,0.6931818181818182,41-90,soc4,41-9011.00 | 41-9012.00 | 41-9021.00 | 41-9022.00 | 41-9031.00,Demonstrators and Product Promoters | Models | Real Estate Brokers | Real Estate Sales Agents | Sales Engineers,7,0.1804108055714285,webb_soc4_ai_score,soc4,webb_exposure_by_soc4.xlsx,exposure_by_soc4,-1.1802004749934019,0.1111111111111111,Real estate brokers and sales agents
