comparison_key,raw_naics_examples,raw_title_examples,source_row_count,metric_value,comparison_title,metric_name,comparison_level,source_file,sheet_name,metric_zscore,metric_percentile
7223,722300,Special Food Services,1,-0.729668,Special food services,felten_language_modeling_aiie,naics4,Language_Modeling_AIOE_and_AIIE.xlsx,LM AIIE,-0.7304313867248136,0.3089430894308943
7224,722400,Drinking Places (Alcoholic Beverages),1,-0.651397,Drinking places (alcoholic beverages),felten_language_modeling_aiie,naics4,Language_Modeling_AIOE_and_AIIE.xlsx,LM AIIE,-0.6524348440739792,0.33739837398373984
7225,722500,Restaurants and Other Eating Places,1,-0.772517,Restaurants and Other Eating Places,felten_language_modeling_aiie,naics4,Language_Modeling_AIOE_and_AIIE.xlsx,LM AIIE,-0.7731301366583215,0.2845528455284553
8111,811100,Automotive Repair and Maintenance,1,-1.114094,Automotive repair and maintenance,felten_language_modeling_aiie,naics4,Language_Modeling_AIOE_and_AIIE.xlsx,LM AIIE,-1.1135093965252458,0.14634146341463414
8112,811200,Electronic and Precision Equipment Repair and Maintenance,1,-0.0773292,Electronic and precision equipment repair and maintenance,felten_language_modeling_aiie,naics4,Language_Modeling_AIOE_and_AIIE.xlsx,LM AIIE,-0.08038001345765108,0.5121951219512195
8113,811300,Commercial and Industrial Machinery and Equipment (except Automotive and Electronic) Repair and Maintenance,1,-0.879418,Commercial and industrial machinery and equipment (except automotive and electronic) repair and maintenance,felten_language_modeling_aiie,naics4,Language_Modeling_AIOE_and_AIIE.xlsx,LM AIIE,-0.8796562881820895,0.22764227642276422
8114,811400,Personal and Household Goods Repair and Maintenance,1,-0.8000787,Personal and household goods repair and maintenance,felten_language_modeling_aiie,naics4,Language_Modeling_AIOE_and_AIIE.xlsx,LM AIIE,-0.8005951915264017,0.2601626016260163
8121,812100,Personal Care Services,1,-0.3100892,Personal care services,felten_language_modeling_aiie,naics4,Language_Modeling_AIOE_and_AIIE.xlsx,LM AIIE,-0.3123238402569535,0.43089430894308944
8122,812200,Death Care Services,1,-0.0593705,Death care services,felten_language_modeling_aiie,naics4,Language_Modeling_AIOE_and_AIIE.xlsx,LM AIIE,-0.06248428565931533,0.5284552845528455
8123,812300,Drycleaning and Laundry Services,1,-0.9959455,Drycleaning and laundry services,felten_language_modeling_aiie,naics4,Language_Modeling_AIOE_and_AIIE.xlsx,LM AIIE,-0.9957751843728254,0.18699186991869918
8129,812900,Other Personal Services,1,-0.5891773,Other personal services,felten_language_modeling_aiie,naics4,Language_Modeling_AIOE_and_AIIE.xlsx,LM AIIE,-0.590433317521717,0.35772357723577236
8131,813100,Religious Organizations,1,1.155523,Religious Organizations,felten_language_modeling_aiie,naics4,Language_Modeling_AIOE_and_AIIE.xlsx,LM AIIE,1.1481491889222204,0.8495934959349594
8132,813200,Grantmaking and Giving Services,1,1.779492,Grantmaking and giving services,felten_language_modeling_aiie,naics4,Language_Modeling_AIOE_and_AIIE.xlsx,LM AIIE,1.7699302409248578,0.943089430894309
8133,813300,Social Advocacy Organizations,1,1.302326,Social advocacy organizations,felten_language_modeling_aiie,naics4,Language_Modeling_AIOE_and_AIIE.xlsx,LM AIIE,1.294437424038297,0.8658536585365854
8134,813400,Civic and Social Organizations,1,0.0471964,Civic and social organizations,felten_language_modeling_aiie,naics4,Language_Modeling_AIOE_and_AIIE.xlsx,LM AIIE,0.04370893738647679,0.5691056910569106
8139,813900,"Business, Professional, Labor, Political, and Similar Organizations",1,1.402145,"Business, professional, labor, political, and similar organizations",felten_language_modeling_aiie,naics4,Language_Modeling_AIOE_and_AIIE.xlsx,LM AIIE,1.3939064086029969,0.8861788617886179
9991,999100,Federal Executive Branch (OES Designation),1,0.9446542,"Federal government, excluding postal service",felten_language_modeling_aiie,naics4,Language_Modeling_AIOE_and_AIIE.xlsx,LM AIIE,0.9380198006055992,0.7926829268292683
9992,999200,"State Government, excluding schools and hospitals (OES Designation)",1,0.7959982,"State government, excluding education and hospitals",felten_language_modeling_aiie,naics4,Language_Modeling_AIOE_and_AIIE.xlsx,LM AIIE,0.7898850630360981,0.7642276422764228
9993,999300,"Local Government, excluding schools and hospitals (OES Designation)",1,0.0238635,"Local government, excluding education and hospitals",felten_language_modeling_aiie,naics4,Language_Modeling_AIOE_and_AIIE.xlsx,LM AIIE,0.02045785422646029,0.5609756097560976
