comparison_key,raw_naics_examples,raw_title_examples,source_row_count,metric_value,comparison_title,metric_name,comparison_level,source_file,sheet_name,metric_zscore,metric_percentile
1133,113300,Logging,1,-1.73983,Logging,felten_language_modeling_aiie,naics4,Language_Modeling_AIOE_and_AIIE.xlsx,LM AIIE,-1.7370512525404043,0.008130081300813009
1151,115100,Support Activities for Crop Production,1,-1.93639,Support Activities for Crop Production,felten_language_modeling_aiie,naics4,Language_Modeling_AIOE_and_AIIE.xlsx,LM AIIE,-1.9329220146802517,0.0040650406504065045
1152,115200,Support Activities for Animal Production,1,-1.034116,Support Activities for Animal Production,felten_language_modeling_aiie,naics4,Language_Modeling_AIOE_and_AIIE.xlsx,LM AIIE,-1.0338118394718234,0.17479674796747968
2111,211100,Oil and Gas Extraction,1,0.4488801,Oil and Gas Extraction,felten_language_modeling_aiie,naics4,Language_Modeling_AIOE_and_AIIE.xlsx,LM AIIE,0.4439841330425299,0.6585365853658537
2121,212100,Coal Mining,1,-1.38403,Coal mining,felten_language_modeling_aiie,naics4,Language_Modeling_AIOE_and_AIIE.xlsx,LM AIIE,-1.3824988656389101,0.06097560975609756
2122,212200,Metal Ore Mining,1,-1.112581,Metal ore mining,felten_language_modeling_aiie,naics4,Language_Modeling_AIOE_and_AIIE.xlsx,LM AIIE,-1.1120017018614405,0.15040650406504066
2123,212300,Nonmetallic Mineral Mining and Quarrying,1,-1.219409,Nonmetallic mineral mining and quarrying,felten_language_modeling_aiie,naics4,Language_Modeling_AIOE_and_AIIE.xlsx,LM AIIE,-1.2184551093597902,0.08130081300813008
2131,213100,Support Activities for Mining,1,-1.103578,Support Activities for Mining,felten_language_modeling_aiie,naics4,Language_Modeling_AIOE_and_AIIE.xlsx,LM AIIE,-1.103030270891024,0.15447154471544716
2211,221100,"Electric Power Generation, Transmission and Distribution",1,0.0499917,"Electric power generation, transmission and distribution",felten_language_modeling_aiie,naics4,Language_Modeling_AIOE_and_AIIE.xlsx,LM AIIE,0.04649443566389598,0.573170731707317
2212,221200,Natural Gas Distribution,1,0.2033846,Natural gas distribution,felten_language_modeling_aiie,naics4,Language_Modeling_AIOE_and_AIIE.xlsx,LM AIIE,0.19934946328824169,0.6056910569105691
2213,221300,"Water, Sewage and Other Systems",1,-0.2695695,"Water, sewage and other systems",felten_language_modeling_aiie,naics4,Language_Modeling_AIOE_and_AIIE.xlsx,LM AIIE,-0.27194622263038665,0.44308943089430897
2361,236100,Residential Building Construction,1,-0.7263659,Residential building construction,felten_language_modeling_aiie,naics4,Language_Modeling_AIOE_and_AIIE.xlsx,LM AIIE,-0.7271408655421621,0.3130081300813008
2362,236200,Nonresidential Building Construction,1,-0.7161099,Nonresidential building construction,felten_language_modeling_aiie,naics4,Language_Modeling_AIOE_and_AIIE.xlsx,LM AIIE,-0.716920828217649,0.3170731707317073
2371,237100,Utility System Construction,1,-1.218836,Utility system construction,felten_language_modeling_aiie,naics4,Language_Modeling_AIOE_and_AIIE.xlsx,LM AIIE,-1.2178841185849318,0.08536585365853659
2372,237200,Land Subdivision,1,0.4659384,Land subdivision,felten_language_modeling_aiie,naics4,Language_Modeling_AIOE_and_AIIE.xlsx,LM AIIE,0.46098261809447416,0.6747967479674797
2373,237300,"Highway, Street, and Bridge Construction",1,-1.362089,"Highway, street, and bridge construction",felten_language_modeling_aiie,naics4,Language_Modeling_AIOE_and_AIIE.xlsx,LM AIIE,-1.3606348017799847,0.06504065040650407
2379,237900,Other Heavy and Civil Engineering Construction,1,-1.16696,Other heavy and civil engineering construction,felten_language_modeling_aiie,naics4,Language_Modeling_AIOE_and_AIIE.xlsx,LM AIIE,-1.1661900218370345,0.11382113821138211
2381,238100,"Foundation, Structure, and Building Exterior Contractors",1,-1.621387,"Foundation, structure, and building exterior contractors",felten_language_modeling_aiie,naics4,Language_Modeling_AIOE_and_AIIE.xlsx,LM AIIE,-1.6190235730525635,0.012195121951219513
2382,238200,Building Equipment Contractors,1,-0.9264848,Building equipment contractors,felten_language_modeling_aiie,naics4,Language_Modeling_AIOE_and_AIIE.xlsx,LM AIIE,-0.9265580483951733,0.2032520325203252
2383,238300,Building Finishing Contractors,1,-1.44051,Building finishing contractors,felten_language_modeling_aiie,naics4,Language_Modeling_AIOE_and_AIIE.xlsx,LM AIIE,-1.4387808184556508,0.04878048780487805
2389,238900,Other Specialty Trade Contractors,1,-1.392268,Other specialty trade contractors,felten_language_modeling_aiie,naics4,Language_Modeling_AIOE_and_AIIE.xlsx,LM AIIE,-1.3907079790826833,0.056910569105691054
3111,311100,Animal Food Manufacturing,1,-0.8605075,Animal food manufacturing,felten_language_modeling_aiie,naics4,Language_Modeling_AIOE_and_AIIE.xlsx,LM AIIE,-0.8608120978715197,0.23577235772357724
3112,311200,Grain and Oilseed Milling,1,-0.7862635,Grain and oilseed milling,felten_language_modeling_aiie,naics4,Language_Modeling_AIOE_and_AIIE.xlsx,LM AIIE,-0.7868284345406751,0.2764227642276423
3113,311300,Sugar and Confectionery Product Manufacturing,1,-0.7428267,Sugar and confectionery product manufacturing,felten_language_modeling_aiie,naics4,Language_Modeling_AIOE_and_AIIE.xlsx,LM AIIE,-0.7435439457285254,0.2967479674796748
3114,311400,Fruit and Vegetable Preserving and Specialty Food Manufacturing,1,-0.9997897,Fruit and vegetable preserving and specialty food manufacturing,felten_language_modeling_aiie,naics4,Language_Modeling_AIOE_and_AIIE.xlsx,LM AIIE,-0.9996059046812198,0.18292682926829268
3115,311500,Dairy Product Manufacturing,1,-0.8946212,Dairy product manufacturing,felten_language_modeling_aiie,naics4,Language_Modeling_AIOE_and_AIIE.xlsx,LM AIIE,-0.8948061781442614,0.21544715447154472
3116,311600,Animal Slaughtering and Processing,1,-1.515035,Animal slaughtering and processing,felten_language_modeling_aiie,naics4,Language_Modeling_AIOE_and_AIIE.xlsx,LM AIIE,-1.5130444964596808,0.036585365853658534
3117,311700,Seafood Product Preparation and Packaging,1,-1.162078,Seafood product preparation and packaging,felten_language_modeling_aiie,naics4,Language_Modeling_AIOE_and_AIIE.xlsx,LM AIIE,-1.1613251405755023,0.11788617886178862
3118,311800,Bakeries and Tortilla Manufacturing,1,-0.7666731,Bakeries and tortilla manufacturing,felten_language_modeling_aiie,naics4,Language_Modeling_AIOE_and_AIIE.xlsx,LM AIIE,-0.7673067283002168,0.2886178861788618
3119,311900,Other Food Manufacturing,1,-0.8497112,Other food manufacturing,felten_language_modeling_aiie,naics4,Language_Modeling_AIOE_and_AIIE.xlsx,LM AIIE,-0.8500536551095619,0.23983739837398374
3121,312100,Beverage Manufacturing,1,-0.5721259,Beverage manufacturing,felten_language_modeling_aiie,naics4,Language_Modeling_AIOE_and_AIIE.xlsx,LM AIIE,-0.573441708274915,0.36585365853658536
3122,312200,Tobacco Manufacturing,1,-0.9705914,Tobacco manufacturing,felten_language_modeling_aiie,naics4,Language_Modeling_AIOE_and_AIIE.xlsx,LM AIIE,-0.9705099885528727,0.1910569105691057
3131,313100,"Fiber, Yarn, and Thread Mills",1,-1.614728,"Fiber, Yarn, and Thread Mills",felten_language_modeling_aiie,naics4,Language_Modeling_AIOE_and_AIIE.xlsx,LM AIIE,-1.6123879228435218,0.016260162601626018
3132,313200,Fabric Mills,1,-1.129803,Fabric Mills,felten_language_modeling_aiie,naics4,Language_Modeling_AIOE_and_AIIE.xlsx,LM AIIE,-1.1291633128991512,0.13008130081300814
3133,313300,Textile and Fabric Finishing and Fabric Coating Mills,1,-0.5264533,Textile and Fabric Finishing and Fabric Coating Mills,felten_language_modeling_aiie,naics4,Language_Modeling_AIOE_and_AIIE.xlsx,LM AIIE,-0.5279292592979696,0.37398373983739835
3141,314100,Textile Furnishings Mills,1,-1.210906,Textile Furnishings Mills,felten_language_modeling_aiie,naics4,Language_Modeling_AIOE_and_AIIE.xlsx,LM AIIE,-1.2099819251388138,0.09349593495934959
3149,314900,Other Textile Product Mills,1,-0.7875527,Other Textile Product Mills,felten_language_modeling_aiie,naics4,Language_Modeling_AIOE_and_AIIE.xlsx,LM AIIE,-0.7881131139594311,0.27235772357723576
3151,315100,Apparel Knitting Mills,1,-1.238002,Apparel Knitting Mills,felten_language_modeling_aiie,naics4,Language_Modeling_AIOE_and_AIIE.xlsx,LM AIIE,-1.2369829129844654,0.07723577235772358
3152,315200,Cut and Sew Apparel Manufacturing,1,-0.8943688,Cut and Sew Apparel Manufacturing,felten_language_modeling_aiie,naics4,Language_Modeling_AIOE_and_AIIE.xlsx,LM AIIE,-0.8945546631851441,0.21951219512195122
3159,315900,Apparel Accessories and Other Apparel Manufacturing,1,-1.059133,Apparel Accessories and Other Apparel Manufacturing,felten_language_modeling_aiie,naics4,Language_Modeling_AIOE_and_AIIE.xlsx,LM AIIE,-1.0587411173333037,0.16260162601626016
3161,316100,Leather and Hide Tanning and Finishing,1,-1.134037,Leather and Hide Tanning and Finishing,felten_language_modeling_aiie,naics4,Language_Modeling_AIOE_and_AIIE.xlsx,LM AIIE,-1.1333824663734091,0.12601626016260162
3162,316200,Footwear Manufacturing,1,-0.591018,Footwear Manufacturing,felten_language_modeling_aiie,naics4,Language_Modeling_AIOE_and_AIIE.xlsx,LM AIIE,-0.5922675631051054,0.35365853658536583
3169,316900,Other Leather and Allied Product Manufacturing,1,-0.8250354,Other Leather and Allied Product Manufacturing,felten_language_modeling_aiie,naics4,Language_Modeling_AIOE_and_AIIE.xlsx,LM AIIE,-0.8254643808298995,0.24796747967479674
3211,321100,Sawmills and Wood Preservation,1,-1.499142,Sawmills and wood preservation,felten_language_modeling_aiie,naics4,Language_Modeling_AIOE_and_AIIE.xlsx,LM AIIE,-1.4972072252819815,0.04065040650406504
3212,321200,"Veneer, Plywood, and Engineered Wood Product Manufacturing",1,-1.211077,"Veneer, plywood, and engineered wood product manufacturing",felten_language_modeling_aiie,naics4,Language_Modeling_AIOE_and_AIIE.xlsx,LM AIIE,-1.210152325527122,0.08943089430894309
3219,321900,Other Wood Product Manufacturing,1,-1.183151,Other wood product manufacturing,felten_language_modeling_aiie,naics4,Language_Modeling_AIOE_and_AIIE.xlsx,LM AIIE,-1.1823242480774,0.1016260162601626
3221,322100,"Pulp, Paper, and Paperboard Mills",1,-1.054775,"Pulp, paper, and paperboard mills",felten_language_modeling_aiie,naics4,Language_Modeling_AIOE_and_AIIE.xlsx,LM AIIE,-1.0543983986651848,0.16666666666666666
3222,322200,Converted Paper Product Manufacturing,1,-0.885119,Converted paper product manufacturing,felten_language_modeling_aiie,naics4,Language_Modeling_AIOE_and_AIIE.xlsx,LM AIIE,-0.8853372976192041,0.22357723577235772
3231,323100,Printing and Related Support Activities,1,-0.3234247,Printing and Related Support Activities,felten_language_modeling_aiie,naics4,Language_Modeling_AIOE_and_AIIE.xlsx,LM AIIE,-0.3256125793112673,0.4268292682926829
3241,324100,Petroleum and Coal Products Manufacturing,1,-0.4347589,Petroleum and Coal Products Manufacturing,felten_language_modeling_aiie,naics4,Language_Modeling_AIOE_and_AIIE.xlsx,LM AIIE,-0.4365563858142699,0.3902439024390244
3250,3250A1 | 3250A2,"Chemical Manufacturing (3251, 3252, 3253, and 3259 only) | Chemical Manufacturing (3255 and 3256 only)",2,-0.36296325,"Chemical Manufacturing (3251, 3252, 3253, and 3259 only) | Chemical Manufacturing (3255 and 3256 only)",felten_language_modeling_aiie,naics4,Language_Modeling_AIOE_and_AIIE.xlsx,LM AIIE,-0.36501248734140807,0.4105691056910569
3254,325400,Pharmaceutical and Medicine Manufacturing,1,0.309366,Pharmaceutical and medicine manufacturing,felten_language_modeling_aiie,naics4,Language_Modeling_AIOE_and_AIIE.xlsx,LM AIIE,0.30495923939043956,0.6382113821138211
3261,326100,Plastics Product Manufacturing,1,-0.911464,Plastics product manufacturing,felten_language_modeling_aiie,naics4,Language_Modeling_AIOE_and_AIIE.xlsx,LM AIIE,-0.9115899188471971,0.2073170731707317
3262,326200,Rubber Product Manufacturing,1,-1.120887,Rubber product manufacturing,felten_language_modeling_aiie,naics4,Language_Modeling_AIOE_and_AIIE.xlsx,LM AIIE,-1.1202785768631374,0.13821138211382114
3270,327000,Nonmetallic Mineral Product Manufacturing,1,-1.085041,Nonmetallic Mineral Product Manufacturing,felten_language_modeling_aiie,naics4,Language_Modeling_AIOE_and_AIIE.xlsx,LM AIIE,-1.0845582709022858,0.15853658536585366
3311,331100,Iron and Steel Mills and Ferroalloy Manufacturing,1,-1.134565,Iron and steel mills and ferroalloy manufacturing,felten_language_modeling_aiie,naics4,Language_Modeling_AIOE_and_AIIE.xlsx,LM AIIE,-1.1339086149408177,0.12195121951219512
3312,331200,Steel Product Manufacturing from Purchased Steel,1,-1.026607,Steel product manufacturing from purchased steel,felten_language_modeling_aiie,naics4,Language_Modeling_AIOE_and_AIIE.xlsx,LM AIIE,-1.0263291697887338,0.17886178861788618
3313,331300,Alumina and Aluminum Production and Processing,1,-1.117275,Alumina and aluminum production and processing,felten_language_modeling_aiie,naics4,Language_Modeling_AIOE_and_AIIE.xlsx,LM AIIE,-1.116679242345183,0.14227642276422764
3314,331400,Nonferrous Metal (except Aluminum) Production and Processing,1,-0.8714696,Nonferrous metal (except aluminum) production and processing,felten_language_modeling_aiie,naics4,Language_Modeling_AIOE_and_AIIE.xlsx,LM AIIE,-0.8717357592555918,0.23170731707317074
3315,331500,Foundries,1,-1.168177,Foundries,felten_language_modeling_aiie,naics4,Language_Modeling_AIOE_and_AIIE.xlsx,LM AIIE,-1.1674027544251715,0.10975609756097561
3320,3320A1 | 3320A2,"Fabricated Metal Product Manufacturing (3321, 3322, 3325, 3326, and 3329 only) | Fabricated Metal Product Manufacturing (3323 and 3324 only)",2,-0.73622235,"Fabricated Metal Product Manufacturing (3321, 3322, 3325, 3326, and 3329 only) | Fabricated Metal Product Manufacturing (3323 and 3324 only)",felten_language_modeling_aiie,naics4,Language_Modeling_AIOE_and_AIIE.xlsx,LM AIIE,-0.7369627538891975,0.3008130081300813
3327,332700,"Machine Shops; Turned Product; and Screw, Nut, and Bolt Manufacturing",1,-0.7429362,"Machine shops; turned product; and screw, nut, and bolt manufacturing",felten_language_modeling_aiie,naics4,Language_Modeling_AIOE_and_AIIE.xlsx,LM AIIE,-0.7436530617666529,0.2926829268292683
3328,332800,"Coating, Engraving, Heat Treating, and Allied Activities",1,-0.8038041,"Coating, engraving, heat treating, and allied activities",felten_language_modeling_aiie,naics4,Language_Modeling_AIOE_and_AIIE.xlsx,LM AIIE,-0.8043075284071292,0.25609756097560976
3330,3330A1,"Machinery Manufacturing (3331, 3332, 3334, and 3339 only)",1,-0.2270722,"Machinery Manufacturing (3331, 3332, 3334, and 3339 only)",felten_language_modeling_aiie,naics4,Language_Modeling_AIOE_and_AIIE.xlsx,LM AIIE,-0.22959793946043477,0.45934959349593496
3333,333300,Commercial and Service Industry Machinery Manufacturing,1,0.1626688,Commercial and service industry machinery manufacturing,felten_language_modeling_aiie,naics4,Language_Modeling_AIOE_and_AIIE.xlsx,LM AIIE,0.1587764332865445,0.5934959349593496
3335,333500,Metalworking Machinery Manufacturing,1,-0.5041936,Metalworking machinery manufacturing,felten_language_modeling_aiie,naics4,Language_Modeling_AIOE_and_AIIE.xlsx,LM AIIE,-0.5057476129609512,0.3821138211382114
3336,333600,"Engine, Turbine, and Power Transmission Equipment Manufacturing",1,-0.0730968,"Engine, turbine, and power transmission equipment manufacturing",felten_language_modeling_aiie,naics4,Language_Modeling_AIOE_and_AIIE.xlsx,LM AIIE,-0.07616245437299149,0.516260162601626
3341,334100,Computer and Peripheral Equipment Manufacturing,1,1.397711,Computer and peripheral equipment manufacturing,felten_language_modeling_aiie,naics4,Language_Modeling_AIOE_and_AIIE.xlsx,LM AIIE,1.389487956428963,0.8821138211382114
3342,334200,Communications Equipment Manufacturing,1,0.991125,Communications equipment manufacturing,felten_language_modeling_aiie,naics4,Language_Modeling_AIOE_and_AIIE.xlsx,LM AIIE,0.9843276506933507,0.8008130081300813
3343,334300,Audio and Video Equipment Manufacturing,1,0.9976608,Audio and video equipment manufacturing,felten_language_modeling_aiie,naics4,Language_Modeling_AIOE_and_AIIE.xlsx,LM AIIE,0.9908405329033304,0.8089430894308943
3344,334400,Semiconductor and Other Electronic Component Manufacturing,1,0.4500771,Semiconductor and other electronic component manufacturing,felten_language_modeling_aiie,naics4,Language_Modeling_AIOE_and_AIIE.xlsx,LM AIIE,0.4451769357606893,0.6626016260162602
3345,334500,"Navigational, Measuring, Electromedical, and Control Instruments Manufacturing",1,0.877932,"Navigational, measuring, electromedical, and control instruments manufacturing",felten_language_modeling_aiie,naics4,Language_Modeling_AIOE_and_AIIE.xlsx,LM AIIE,0.87153156207463,0.7764227642276422
3346,334600,Manufacturing and Reproducing Magnetic and Optical Media,1,0.1217256,Manufacturing and reproducing magnetic and optical media,felten_language_modeling_aiie,naics4,Language_Modeling_AIOE_and_AIIE.xlsx,LM AIIE,0.11797680066320204,0.5813008130081301
3351,335100,Electric Lighting Equipment Manufacturing,1,0.4803347,Electric lighting equipment manufacturing,felten_language_modeling_aiie,naics4,Language_Modeling_AIOE_and_AIIE.xlsx,LM AIIE,0.47532843745239994,0.6829268292682927
3352,335200,Household Appliance Manufacturing,1,-0.1022941,Household appliance manufacturing,felten_language_modeling_aiie,naics4,Language_Modeling_AIOE_and_AIIE.xlsx,LM AIIE,-0.1052573740078397,0.5
3353,335300,Electrical Equipment Manufacturing,1,0.1497846,Electrical equipment manufacturing,felten_language_modeling_aiie,naics4,Language_Modeling_AIOE_and_AIIE.xlsx,LM AIIE,0.14593741174827515,0.5894308943089431
3359,335900,Other Electrical Equipment and Component Manufacturing,1,-0.1593534,Other electrical equipment and component manufacturing,felten_language_modeling_aiie,naics4,Language_Modeling_AIOE_and_AIIE.xlsx,LM AIIE,-0.16211659550848173,0.4878048780487805
3361,336100,Motor Vehicle Manufacturing,1,-0.4568835,Motor vehicle manufacturing,felten_language_modeling_aiie,naics4,Language_Modeling_AIOE_and_AIIE.xlsx,LM AIIE,-0.45860340587958975,0.3861788617886179
3362,336200,Motor Vehicle Body and Trailer Manufacturing,1,-0.89675,Motor vehicle body and trailer manufacturing,felten_language_modeling_aiie,naics4,Language_Modeling_AIOE_and_AIIE.xlsx,LM AIIE,-0.8969275135046771,0.21138211382113822
3363,336300,Motor Vehicle Parts Manufacturing,1,-0.7298725,Motor vehicle parts manufacturing,felten_language_modeling_aiie,naics4,Language_Modeling_AIOE_and_AIIE.xlsx,LM AIIE,-0.7306351696453346,0.3048780487804878
3364,336400,Aerospace Product and Parts Manufacturing,1,0.2732446,Aerospace product and parts manufacturing,felten_language_modeling_aiie,naics4,Language_Modeling_AIOE_and_AIIE.xlsx,LM AIIE,0.2689644991199966,0.6219512195121951
3365,336500,Railroad Rolling Stock Manufacturing,1,-0.792437,Railroad rolling stock manufacturing,felten_language_modeling_aiie,naics4,Language_Modeling_AIOE_and_AIIE.xlsx,LM AIIE,-0.7929802871560105,0.2682926829268293
3366,336600,Ship and Boat Building,1,-0.7998238,Ship and boat building,felten_language_modeling_aiie,naics4,Language_Modeling_AIOE_and_AIIE.xlsx,LM AIIE,-0.8003411853335372,0.26422764227642276
3369,336900,Other Transportation Equipment Manufacturing,1,-0.297176,Other transportation equipment manufacturing,felten_language_modeling_aiie,naics4,Language_Modeling_AIOE_and_AIIE.xlsx,LM AIIE,-0.2994559204072166,0.4349593495934959
3370,3370A1,Furniture and Related Product Manufacturing (3371 and 3372 only),1,-1.048481,Furniture and Related Product Manufacturing (3371 and 3372 only),felten_language_modeling_aiie,naics4,Language_Modeling_AIOE_and_AIIE.xlsx,LM AIIE,-1.048126468583234,0.17073170731707318
3379,337900,Other Furniture Related Product Manufacturing,1,-0.6635574,Other furniture related product manufacturing,felten_language_modeling_aiie,naics4,Language_Modeling_AIOE_and_AIIE.xlsx,LM AIIE,-0.6645526036177593,0.32926829268292684
3391,339100,Medical Equipment and Supplies Manufacturing,1,0.013895,Medical equipment and supplies manufacturing,felten_language_modeling_aiie,naics4,Language_Modeling_AIOE_and_AIIE.xlsx,LM AIIE,0.010524308782875282,0.556910569105691
3399,339900,Other Miscellaneous Manufacturing,1,-0.1698289,Other miscellaneous manufacturing,felten_language_modeling_aiie,naics4,Language_Modeling_AIOE_and_AIIE.xlsx,LM AIIE,-0.17255536315599887,0.4796747967479675
4230,4230A1,"Merchant Wholesalers, Durable Goods (4232, 4233, 4235, 4236, 4237, and 4239 only)",1,0.279742,"Merchant Wholesalers, Durable Goods (4232, 4233, 4235, 4236, 4237, and 4239 only)",felten_language_modeling_aiie,naics4,Language_Modeling_AIOE_and_AIIE.xlsx,LM AIIE,0.2754391159796193,0.6260162601626016
4231,423100,Motor Vehicle and Motor Vehicle Parts and Supplies Merchant Wholesalers,1,-0.1336922,Motor vehicle and motor vehicle parts and supplies merchant wholesalers,felten_language_modeling_aiie,naics4,Language_Modeling_AIOE_and_AIIE.xlsx,LM AIIE,-0.13654537653502297,0.491869918699187
4234,423400,Professional and Commercial Equipment and Supplies Merchant Wholesalers,1,1.011622,Professional and commercial equipment and supplies merchant wholesalers,felten_language_modeling_aiie,naics4,Language_Modeling_AIOE_and_AIIE.xlsx,LM AIIE,1.0047527779398935,0.8170731707317073
4238,423800,"Machinery, Equipment, and Supplies Merchant Wholesalers",1,0.2634982,"Machinery, equipment, and supplies merchant wholesalers",felten_language_modeling_aiie,naics4,Language_Modeling_AIOE_and_AIIE.xlsx,LM AIIE,0.2592522748825128,0.6138211382113821
4240,4240A2 | 4240A1 | 4240A3,"Merchant Wholesalers, Nondurable Goods (4242 and 4246 only) | Merchant Wholesalers, Nondurable Goods (4244 and 4248 only) | Merchant Wholesalers, Nondurable Goods (4241, 4247, and 4249 only)",3,0.1395530333333333,"Merchant Wholesalers, Nondurable Goods (4242 and 4246 only) | Merchant Wholesalers, Nondurable Goods (4244 and 4248 only) | Merchant Wholesalers, Nondurable Goods (4241, 4247, and 4249 only)",felten_language_modeling_aiie,naics4,Language_Modeling_AIOE_and_AIIE.xlsx,LM AIIE,0.13574172208158478,0.5853658536585366
4243,424300,"Apparel, Piece Goods, and Notions Merchant Wholesalers",1,0.7209005,"Apparel, piece goods, and notions merchant wholesalers",felten_language_modeling_aiie,naics4,Language_Modeling_AIOE_and_AIIE.xlsx,LM AIIE,0.7150506932052596,0.7560975609756098
4245,424500,Farm Product Raw Material Merchant Wholesalers,1,-0.6865089,Farm product raw material merchant wholesalers,felten_language_modeling_aiie,naics4,Language_Modeling_AIOE_and_AIIE.xlsx,LM AIIE,-0.687423624157303,0.3252032520325203
4251,425100,Wholesale Electronic Markets and Agents and Brokers,1,1.062347,Wholesale Electronic Markets and Agents and Brokers,felten_language_modeling_aiie,naics4,Language_Modeling_AIOE_and_AIIE.xlsx,LM AIIE,1.05529991067058,0.8373983739837398
4411,441100,Automobile Dealers,1,-0.0857672,Automobile dealers,felten_language_modeling_aiie,naics4,Language_Modeling_AIOE_and_AIIE.xlsx,LM AIIE,-0.08878842560120029,0.508130081300813
4412,441200,Other Motor Vehicle Dealers,1,-0.0086145,Other motor vehicle dealers,felten_language_modeling_aiie,naics4,Language_Modeling_AIOE_and_AIIE.xlsx,LM AIIE,-0.011906261630163456,0.5447154471544715
4413,441300,"Automotive Parts, Accessories, and Tire Stores",1,-0.5935317,"Automotive parts, accessories, and tire retailers",felten_language_modeling_aiie,naics4,Language_Modeling_AIOE_and_AIIE.xlsx,LM AIIE,-0.59477244881324,0.34959349593495936
4421,442100,Furniture Stores,1,0.1916725,Furniture Stores,felten_language_modeling_aiie,naics4,Language_Modeling_AIOE_and_AIIE.xlsx,LM AIIE,0.18767843178000956,0.6016260162601627
4422,442200,Home Furnishings Stores,1,0.295247,Home Furnishings Stores,felten_language_modeling_aiie,naics4,Language_Modeling_AIOE_and_AIIE.xlsx,LM AIIE,0.29088974767975323,0.6341463414634146
4431,443100,Electronics and Appliance Stores,1,0.5540931,Electronics and Appliance Stores,felten_language_modeling_aiie,naics4,Language_Modeling_AIOE_and_AIIE.xlsx,LM AIIE,0.5488282035401885,0.7073170731707317
4441,444100,Building Material and Supplies Dealers,1,0.3544964,Building material and supplies dealers,felten_language_modeling_aiie,naics4,Language_Modeling_AIOE_and_AIIE.xlsx,LM AIIE,0.3499313895922923,0.6422764227642277
4442,444200,Lawn and Garden Equipment and Supplies Stores,1,-0.2473165,Lawn and garden equipment and supplies retailers,felten_language_modeling_aiie,naics4,Language_Modeling_AIOE_and_AIIE.xlsx,LM AIIE,-0.2497712527998106,0.45121951219512196
4450,4450A1,Food and Beverage Stores (4451 and 4452 only),1,-0.187831,Food and Beverage Stores (4451 and 4452 only),felten_language_modeling_aiie,naics4,Language_Modeling_AIOE_and_AIIE.xlsx,LM AIIE,-0.19049433877218602,0.47560975609756095
4453,445300,"Beer, Wine, and Liquor Stores",1,0.2288,"Beer, wine, and liquor retailers",felten_language_modeling_aiie,naics4,Language_Modeling_AIOE_and_AIIE.xlsx,LM AIIE,0.22467574415967576,0.6097560975609756
4461,446100,Health and Personal Care Stores,1,0.4043418,Health and Personal Care Stores,felten_language_modeling_aiie,naics4,Language_Modeling_AIOE_and_AIIE.xlsx,LM AIIE,0.399602006641364,0.6463414634146342
4471,447100,Gasoline Stations,1,-0.1060679,Gasoline Stations,felten_language_modeling_aiie,naics4,Language_Modeling_AIOE_and_AIIE.xlsx,LM AIIE,-0.10901794117391295,0.4959349593495935
4481,448100,Clothing Stores,1,0.5698005,Clothing Stores,felten_language_modeling_aiie,naics4,Language_Modeling_AIOE_and_AIIE.xlsx,LM AIIE,0.5644805255244958,0.7113821138211383
4482,448200,Shoe Stores,1,0.6448641,Shoe Stores,felten_language_modeling_aiie,naics4,Language_Modeling_AIOE_and_AIIE.xlsx,LM AIIE,0.6392809149270224,0.7276422764227642
4483,448300,"Jewelry, Luggage, and Leather Goods Stores",1,0.5883098,"Jewelry, Luggage, and Leather Goods Stores",felten_language_modeling_aiie,naics4,Language_Modeling_AIOE_and_AIIE.xlsx,LM AIIE,0.5829249226433149,0.7195121951219512
